{
  "schema": "operatebench.identity_field_census.v2",
  "schema_version": 2,
  "artifact_schema": "operatebench.b1_card_contract.v2",
  "entries": [
    {
      "field_path_pattern": "/contract_resources/card-defs-v2.schema.json",
      "owner": "card_schema_content",
      "source_paths": [
        "docs/schemas/card-defs-v2.schema.json"
      ],
      "consumers": [
        "package_loader",
        "card_validator"
      ],
      "nullability": "never",
      "cardinality": "exact"
    },
    {
      "field_path_pattern": "/contract_resources/operation-card-v2.schema.json",
      "owner": "card_schema_content",
      "source_paths": [
        "docs/schemas/operation-card-v2.schema.json"
      ],
      "consumers": [
        "package_loader",
        "card_validator"
      ],
      "nullability": "never",
      "cardinality": "exact"
    },
    {
      "field_path_pattern": "/contract_resources/semantic-scenario-card-v2.schema.json",
      "owner": "card_schema_content",
      "source_paths": [
        "docs/schemas/semantic-scenario-card-v2.schema.json"
      ],
      "consumers": [
        "package_loader",
        "card_validator"
      ],
      "nullability": "never",
      "cardinality": "exact"
    },
    {
      "field_path_pattern": "/contract_resources/variant-card-v2.schema.json",
      "owner": "card_schema_content",
      "source_paths": [
        "docs/schemas/variant-card-v2.schema.json"
      ],
      "consumers": [
        "package_loader",
        "card_validator"
      ],
      "nullability": "never",
      "cardinality": "exact"
    },
    {
      "field_path_pattern": "/contract_resources/card-registry-v2.json",
      "owner": "card_schema_content",
      "source_paths": [
        "docs/schemas/card-registry-v2.json"
      ],
      "consumers": [
        "package_loader",
        "card_validator"
      ],
      "nullability": "never",
      "cardinality": "exact"
    },
    {
      "field_path_pattern": "/contract_resources/identity-field-census-v2.schema.json",
      "owner": "card_schema_content",
      "source_paths": [
        "docs/schemas/identity-field-census-v2.schema.json"
      ],
      "consumers": [
        "package_loader",
        "card_validator"
      ],
      "nullability": "never",
      "cardinality": "exact"
    },
    {
      "field_path_pattern": "/contract_resources/identity-field-census-v2.registry.json",
      "owner": "card_schema_content",
      "source_paths": [
        "docs/schemas/identity-field-census-v2.registry.json"
      ],
      "consumers": [
        "package_loader",
        "card_validator"
      ],
      "nullability": "never",
      "cardinality": "exact"
    },
    {
      "field_path_pattern": "/operation_card_v2/schema",
      "owner": "operation_core_content",
      "source_paths": [
        "src/operatebench/cards.py",
        "docs/schemas/operation-card-v2.schema.json"
      ],
      "consumers": [
        "card_loader",
        "card_validator",
        "identity_manifest_input"
      ],
      "nullability": "never",
      "cardinality": "exact"
    },
    {
      "field_path_pattern": "/operation_card_v2/schema_version",
      "owner": "operation_core_content",
      "source_paths": [
        "src/operatebench/cards.py",
        "docs/schemas/operation-card-v2.schema.json"
      ],
      "consumers": [
        "card_loader",
        "card_validator",
        "identity_manifest_input"
      ],
      "nullability": "never",
      "cardinality": "exact"
    },
    {
      "field_path_pattern": "/operation_card_v2/id",
      "owner": "operation_core_content",
      "source_paths": [
        "src/operatebench/cards.py",
        "docs/schemas/operation-card-v2.schema.json"
      ],
      "consumers": [
        "card_loader",
        "card_validator",
        "identity_manifest_input"
      ],
      "nullability": "never",
      "cardinality": "exact"
    },
    {
      "field_path_pattern": "/operation_card_v2/content_digest_sha256",
      "owner": "operation_core_content",
      "source_paths": [
        "src/operatebench/cards.py",
        "docs/schemas/operation-card-v2.schema.json"
      ],
      "consumers": [
        "card_loader",
        "card_validator",
        "identity_manifest_input"
      ],
      "nullability": "never",
      "cardinality": "exact"
    },
    {
      "field_path_pattern": "/operation_card_v2/content/operation_type",
      "owner": "operation_core_content",
      "source_paths": [
        "src/operatebench/cards.py",
        "docs/schemas/operation-card-v2.schema.json"
      ],
      "consumers": [
        "card_loader",
        "card_validator",
        "identity_manifest_input"
      ],
      "nullability": "never",
      "cardinality": "exact"
    },
    {
      "field_path_pattern": "/operation_card_v2/content/operation_version",
      "owner": "operation_core_content",
      "source_paths": [
        "src/operatebench/cards.py",
        "docs/schemas/operation-card-v2.schema.json"
      ],
      "consumers": [
        "card_loader",
        "card_validator",
        "identity_manifest_input"
      ],
      "nullability": "never",
      "cardinality": "exact"
    },
    {
      "field_path_pattern": "/operation_card_v2/content/state_contract/schema_id",
      "owner": "operation_core_content",
      "source_paths": [
        "src/operatebench/cards.py",
        "docs/schemas/operation-card-v2.schema.json"
      ],
      "consumers": [
        "card_loader",
        "card_validator",
        "identity_manifest_input"
      ],
      "nullability": "never",
      "cardinality": "exact"
    },
    {
      "field_path_pattern": "/operation_card_v2/content/state_contract/initial_state_schema",
      "owner": "operation_core_content",
      "source_paths": [
        "src/operatebench/cards.py",
        "docs/schemas/operation-card-v2.schema.json"
      ],
      "consumers": [
        "card_loader",
        "card_validator",
        "identity_manifest_input"
      ],
      "nullability": "never",
      "cardinality": "exact"
    },
    {
      "field_path_pattern": "/operation_card_v2/content/state_contract/canonical_state_projection",
      "owner": "operation_core_content",
      "source_paths": [
        "src/operatebench/cards.py",
        "docs/schemas/operation-card-v2.schema.json"
      ],
      "consumers": [
        "card_loader",
        "card_validator",
        "identity_manifest_input"
      ],
      "nullability": "never",
      "cardinality": "exact"
    },
    {
      "field_path_pattern": "/operation_card_v2/content/state_contract/replay_final_pointer",
      "owner": "operation_core_content",
      "source_paths": [
        "src/operatebench/cards.py",
        "docs/schemas/operation-card-v2.schema.json"
      ],
      "consumers": [
        "card_loader",
        "card_validator",
        "identity_manifest_input"
      ],
      "nullability": "never",
      "cardinality": "exact"
    },
    {
      "field_path_pattern": "/operation_card_v2/content/state_contract/terminal_pointer",
      "owner": "operation_core_content",
      "source_paths": [
        "src/operatebench/cards.py",
        "docs/schemas/operation-card-v2.schema.json"
      ],
      "consumers": [
        "card_loader",
        "card_validator",
        "identity_manifest_input"
      ],
      "nullability": "never",
      "cardinality": "exact"
    },
    {
      "field_path_pattern": "/operation_card_v2/content/authority_contract/roles/role_id",
      "owner": "operation_core_content",
      "source_paths": [
        "src/operatebench/cards.py",
        "docs/schemas/operation-card-v2.schema.json"
      ],
      "consumers": [
        "card_loader",
        "card_validator",
        "identity_manifest_input"
      ],
      "nullability": "never",
      "cardinality": "exact"
    },
    {
      "field_path_pattern": "/operation_card_v2/content/authority_contract/roles/authorities",
      "owner": "operation_core_content",
      "source_paths": [
        "src/operatebench/cards.py",
        "docs/schemas/operation-card-v2.schema.json"
      ],
      "consumers": [
        "card_loader",
        "card_validator",
        "identity_manifest_input"
      ],
      "nullability": "never",
      "cardinality": "exact"
    },
    {
      "field_path_pattern": "/operation_card_v2/content/authority_contract/event_authority/event_type",
      "owner": "operation_core_content",
      "source_paths": [
        "src/operatebench/cards.py",
        "docs/schemas/operation-card-v2.schema.json"
      ],
      "consumers": [
        "card_loader",
        "card_validator",
        "identity_manifest_input"
      ],
      "nullability": "never",
      "cardinality": "exact"
    },
    {
      "field_path_pattern": "/operation_card_v2/content/authority_contract/event_authority/required_authority",
      "owner": "operation_core_content",
      "source_paths": [
        "src/operatebench/cards.py",
        "docs/schemas/operation-card-v2.schema.json"
      ],
      "consumers": [
        "card_loader",
        "card_validator",
        "identity_manifest_input"
      ],
      "nullability": "never",
      "cardinality": "exact"
    },
    {
      "field_path_pattern": "/operation_card_v2/content/authority_contract/action_authority/action_type",
      "owner": "operation_core_content",
      "source_paths": [
        "src/operatebench/cards.py",
        "docs/schemas/operation-card-v2.schema.json"
      ],
      "consumers": [
        "card_loader",
        "card_validator",
        "identity_manifest_input"
      ],
      "nullability": "never",
      "cardinality": "exact"
    },
    {
      "field_path_pattern": "/operation_card_v2/content/authority_contract/action_authority/required_authority",
      "owner": "operation_core_content",
      "source_paths": [
        "src/operatebench/cards.py",
        "docs/schemas/operation-card-v2.schema.json"
      ],
      "consumers": [
        "card_loader",
        "card_validator",